{
  "features": [
    {
      "name": "Product listings",
      "priority": "must-have"
    },
    {
      "name": "Search and browse",
      "priority": "must-have"
    },
    {
      "name": "Shopping cart",
      "priority": "must-have"
    },
    {
      "name": "Reviews",
      "priority": "should-have"
    }
  ],
  "users": [
    {
      "role": "seller",
      "description": "Artisan listing and selling products"
    },
    {
      "role": "buyer",
      "description": "Customer browsing and purchasing"
    }
  ],
  "complexity": "saas",
  "autonomy_level": "semi",
  "adlc": false,
  "estimated_capabilities": 12
}
